{
  "module": "aadp:answer",
  "version": "1.0",
  "kind": "answer",
  "question": "What is Nimbus?",
  "concise_answer": "Nimbus is a neutral example scheduler.",
  "locale": "en",
  "authorship": {
    "kind": "source-authored",
    "author": {
      "name": "Example Editorial Team"
    }
  },
  "freshness": {
    "published_at": "2026-07-01T00:00:00Z",
    "updated_at": "2026-07-01T00:00:00Z"
  },
  "content_checksum": "sha256:b73812ce3ea105660457db9b370647c160daa3c2c66f6b5cee764c6470899f57"
}
